{
  "$schema": "https://json-schema.org/draft/2020-12/schema",
  "title": "CervoRules Agent Task Recipe",
  "type": "object",
  "required": [
    "$schema",
    "id",
    "goal",
    "when_to_use",
    "inputs",
    "outputs",
    "commands",
    "checks",
    "failure_mode"
  ],
  "properties": {
    "$schema": { "type": "string" },
    "id": { "type": "string", "pattern": "^[a-z0-9-]+$" },
    "goal": { "type": "string" },
    "when_to_use": { "type": "string" },
    "inputs": { "type": "array", "items": { "type": "string" } },
    "outputs": { "type": "array", "items": { "type": "string" } },
    "commands": { "type": "array", "items": { "type": "string" }, "minItems": 1 },
    "checks": { "type": "array", "items": { "type": "string" } },
    "failure_mode": { "type": "string" },
    "notes": { "type": "array", "items": { "type": "string" } }
  },
  "additionalProperties": false
}
